<?xml version="1.0"?>
<!DOCTYPE nffgs SYSTEM "nffgInfo.dtd">
<nffgs>
	<nffg name="nffg1" lastUpdate="2015-07-21T21:00:00.000+02:00">
		<node name="node11" functionality="FW"  />
		<node name="node12" functionality="DPI"  />
		<node name="node13" functionality="SPAM"  />

		<link 
			name="link12" 
			src="node11" 
			dst="node12" 
		/>
		
		
		<policy 
			name="policy11" 
			positivity="true"
			src="node11" 
			dst="node12">
			<verification 
						verificationTime="2015-07-21T21:00:00.000+02:00"
						result="true" 
						message="no messages for this policy"
			/>
			
		</policy>
	
		<policy 
			name="policy12" 
			positivity="true"
			src="node11"
			dst="node12"
		>
			<traversal>
				<functionality name="FW" />
				<functionality name="NAT" />
			</traversal>
				
			<verification
				verificationTime="2015-07-21T22:00:00.000+02:00"
				result="true"
				message="no messages for this policy"
			/>
		</policy>


	</nffg>
	
	<nffg 
		name="nffg2" 
		lastUpdate="2015-07-21T21:00:00.000+02:00">
		<node 
			name="node11B" 
			functionality="FW"  />
		<node 
			name="node12B" 
			functionality="DPI"  />
		<node 
			name="node13B" 
			functionality="SPAM"  />

		<link 
			name="link12B" 
			src="node11B" 
			dst="node12B" 
		/>
		
		
		<policy 
			name="policy11B" 
			positivity="true"
			src="node11B" 
			dst="node12B">
			<verification 
					result="false" 
					message="Failed verification"
					verificationTime="2015-07-21T22:00:00.000+02:00"
			/>
			
		</policy>
	
		<policy 
			name="policy12B" 
			positivity="true"
			src="node11B"
			dst="node12B"
		>
			<traversal>
				<functionality name="DPI" />
			</traversal>
			
		</policy>
	</nffg>
</nffgs>

